{
  "id": "personal",
  "revision": 1,
  "name": "Personal",
  "description": "Personal planning, writing, learning, travel, and household tasks.",
  "instructions": {
    "context": "Use a friendly, practical tone and prioritize clear next actions.",
    "dataHandling": [
      "Do not move company or client information into Personal connectors.",
      "Confirm the account and destination before external actions."
    ]
  },
  "capabilities": {
    "skills": [
      {
        "id": "personal-assistant",
        "enabled": true,
        "priority": 100
      }
    ],
    "connectors": [
      {
        "connectorId": "google-calendar",
        "instanceLabel": "Personal calendar",
        "allowedOperations": [
          "read",
          "draft"
        ],
        "activation": "explicit_only"
      }
    ],
    "unknownCapability": "ask"
  },
  "approvals": {
    "read": "follow_native",
    "draft": "follow_native",
    "write": "always_ask",
    "send": "always_ask",
    "delete": "block"
  }
}
